<?xml version="1.0" encoding="euc-kr" standalone="no"?>
<!DOCTYPE superEntry SYSTEM "dic_adverb.dtd">
<superEntry>
	<orth>전국적으로</orth>
	<entry n="1" pos="av">
		
		<mnt_grp>
			<cre>
				<cre_writer>류병률; 남승호</cre_writer>
				<cre_date>2001/06/11</cre_date>
				<cre_note></cre_note>
			</cre>
			<mod>
				<mod_date>2001/09/18</mod_date>
			</mod>
			<note></note>
			<see></see>
		</mnt_grp>
		<morph_grp>
			<var type="xs"></var>
			<var type="xd"></var>
			<var type="xx"></var>
			<str>전국.적-으로</str>
			<org lg="si">全國的__</org>
			<hom exist="temp"></hom>
		</morph_grp>
		<idm_grp>
		</idm_grp>
		<sense n="1">
			<sem_grp>
				<eg>추가 발견도 꾸준히 이어져 ~ 유적지만 열 다섯 군데를 헤아리게 되었다</eg>
				<eg>창업으로 백만장자가 된 교수가 ~ 100여명에 이른다</eg>
				<eg>김씨의 경우처럼 올해 ~ 나타난 냉해는 농민들의 생계를 위협할 수 있다</eg>
				<trans>in all of the country</trans>
				<domain></domain>
				<reg></reg>
				<con></con>
				
				<sem_rep>성분부사/양태부사/방식</sem_rep>
				<lr>
					<syn>국가적으로</syn>
					<ant>국지적으로</ant>
					<hyper></hyper>
					<cohyp></cohyp>
					<hypo></hypo>
					<holo></holo>
					<mero></mero>
					<rel>전국</rel>
					<rel>전국적</rel>
				</lr>
			</sem_grp>
			<syn_grp>
				<comb pos="v" exist="yes">~나타나다</comb>
				<comb pos="adj" exist="yes">~유명하다</comb>
				<comb pos="det" exist="temp"></comb>
				<comb pos="av" exist="temp"></comb>
				<comb pos="n" exist="temp"></comb>
				<prt>~는</prt>
				<prt>~도</prt>
				<prt>~만</prt>
				<argdist type="np"></argdist>
				<argdist type="vp"></argdist>
				<argdist type="ap"></argdist>
				<col></col>
			
			
				<conc type="conj"></conc>
				<conc type="mood"></conc>
				<conc type="mod"></conc>
				<conc type="ta"></conc>
				<conc type="neg"></conc>
				<conc type="agr"></conc>
				<distr>~S~O~V</distr>
			</syn_grp>
		</sense>
	</entry>
</superEntry>
