<?xml version="1.0" encoding="euc-kr" standalone="no"?>
<!DOCTYPE superEntry SYSTEM "dic_adverb.dtd">
<superEntry>
	<orth>겅둥</orth>
	<entry n="1" pos="av">
		
		<mnt_grp>
			<cre>
				<cre_writer>김태경; 남승호</cre_writer>
				<cre_date>2002/04/25</cre_date>
				<cre_note></cre_note>
			</cre>
			<mod>
				<mod_date>2002/07/26</mod_date>
			</mod>
			<note>의태</note>
			<see></see>
		</mnt_grp>
		<morph_grp>
			<var type="xs"></var>
			<var type="xd"></var>
			<var type="xx"></var>
			<var type="lng">겅둥겅둥</var>
			<org lg="temp"></org>
			<hom exist="temp"></hom>
			<der pos="v">~거리다</der>
			<img type="xt">껑뚱</img>
			<img type="xc">강동</img>
		</morph_grp>
		<idm_grp>
		</idm_grp>
		<sense n="1">
			<sem_grp>
				<eg>집값이 한 달 새에 ~ 뛰었다</eg>
				<trans>leaping lightly</trans>
				<domain></domain>
				<reg></reg>
				<con></con>
				
				<sem_rep>성분부사/양태부사/상징</sem_rep>
				<lr>
					<syn>겅중</syn>
					<syn>껑충</syn>
					<ant></ant>
					<hyper></hyper>
					<cohyp></cohyp>
					<holo></holo>
					<mero></mero>
					<rel></rel>
				</lr>
			</sem_grp>
			<syn_grp>
				<comb pos="v" exist="yes">~뛰다</comb>
				<comb pos="v" exist="yes">~오르다</comb>
				<comb pos="adj" exist="no"/>
				<comb pos="det" exist="temp"></comb>
				<comb pos="av" exist="temp"></comb>
				<comb pos="n" exist="temp"></comb>
				<prt></prt>
				<argdist type="np"></argdist>
				<argdist type="vp"></argdist>
				<argdist type="ap"></argdist>
				<col></col>
			
			
				<conc type="conj"></conc>
				<conc type="mood"></conc>
				<conc type="mod"></conc>
				<conc type="ta"></conc>
				<conc type="neg"></conc>
				<conc type="agr"></conc>
				<distr>SO~V</distr>
			</syn_grp>
		</sense>
	</entry>
	<entry n="2" pos="av">
		
		<mnt_grp>
			<cre>
				<cre_writer>김태경; 남승호</cre_writer>
				<cre_date>2002/04/25</cre_date>
				<cre_note></cre_note>
			</cre>
			<mod>
				<mod_date>2002/07/26</mod_date>
			</mod>
			<note>의태</note>
			<see></see>
		</mnt_grp>
		<morph_grp>
			<var type="xs"></var>
			<var type="xd"></var>
			<var type="xx"></var>
			<org lg="temp"></org>
			<hom exist="temp"></hom>
			<comp pos="v">~하다</comp>
			<img type="xt">껑뚱</img>
			<img type="xc">강동</img>
		</morph_grp>
		<idm_grp>
		</idm_grp>
		<sense n="1">
			<sem_grp>
				<eg>키가 갑자기 많이 자라서 바지가 ~ 짧아졌다</eg>
				<trans>too short</trans>
				<domain></domain>
				<reg></reg>
				<con></con>
				
				<sem_rep>성분부사/양태부사/상징</sem_rep>
				<lr>
					<syn>겅중</syn>
					<syn>껑충</syn>
					<ant></ant>
					<hyper></hyper>
					<cohyp></cohyp>
					<holo></holo>
					<mero></mero>
					<rel></rel>
				</lr>
			</sem_grp>
			<syn_grp>
				<comb pos="v" exist="yes">~짧아지다</comb>
				<comb pos="adj" exist="yes">~짧다</comb>
				<comb pos="det" exist="temp"></comb>
				<comb pos="av" exist="temp"></comb>
				<comb pos="n" exist="temp"></comb>
				<prt></prt>
				<argdist type="np"></argdist>
				<argdist type="vp"></argdist>
				<argdist type="ap"></argdist>
				<col></col>
			
			
				<conc type="conj"></conc>
				<conc type="mood"></conc>
				<conc type="mod"></conc>
				<conc type="ta"></conc>
				<conc type="neg"></conc>
				<conc type="agr"></conc>
				<distr>SO~V</distr>
			</syn_grp>
		</sense>
	</entry>
</superEntry>
