<?xml version="1.0" encoding="euc-kr" standalone="no"?>
<!DOCTYPE superEntry SYSTEM "dic_adverb.dtd">
<superEntry>
	<orth>간곡히</orth>
	<entry n="1" pos="av">
		
		<mnt_grp>
			<cre>
				<cre_writer>조지은; 남승호</cre_writer>
				<cre_date>2001/05/12</cre_date>
				<cre_note></cre_note>
			</cre>
			<mod>
				<mod_date>2001/08/27</mod_date>
			</mod>
			<note></note>
			<see></see>
		</mnt_grp>
		<morph_grp>
			<var type="xs"></var>
			<var type="xd"></var>
			<var type="xx"></var>
			<str>간곡.히</str>
			<org lg="temp"></org>
			<hom exist="temp"></hom>
		</morph_grp>
		<idm_grp>
		</idm_grp>
		<sense n="1">
			<sem_grp>
				<eg>영희는 이번 한 번만 용서해 달라고 선생님께 ~ 부탁드렸다</eg>
				<trans>barely</trans>
				<domain></domain>
				<reg></reg>
				<con></con>
				
				<sem_rep>성분부사/양태부사/방식</sem_rep>
				<lr>
					<syn>간절히</syn>
					<ant></ant>
					<hyper></hyper>
					<cohyp></cohyp>
					<hypo></hypo>
					<holo></holo>
					<mero></mero>
					<rel></rel>
				</lr>
			</sem_grp>
			<syn_grp>
				<comb pos="v" exist="yes">~부탁하다</comb>
				<comb pos="v" exist="yes">~말하다</comb>
				<comb pos="adj" exist="no"/>
				<comb pos="det" exist="temp"></comb>
				<comb pos="av" exist="temp"></comb>
				<comb pos="n" exist="temp"></comb>
				<prt></prt>
				<argdist type="np"></argdist>
				<argdist type="vp"></argdist>
				<argdist type="ap"></argdist>
				<col></col>
			
			
				<conc type="conj"></conc>
				<conc type="mood"></conc>
				<conc type="mod"></conc>
				<conc type="ta"></conc>
				<conc type="neg"></conc>
				<conc type="agr"></conc>
				<distr>S~O~V</distr>
			</syn_grp>
		</sense>
	</entry>
</superEntry>
