<?xml version="1.0" encoding="euc-kr" standalone="no"?>
<!DOCTYPE superEntry SYSTEM "dic_adverb.dtd">
<superEntry>
	<orth>구시렁구시렁</orth>
	<entry n="1" pos="av">
		
		<mnt_grp>
			<cre>
				<cre_writer>김태경; 남승호</cre_writer>
				<cre_date>2002/05/23</cre_date>
				<cre_note></cre_note>
			</cre>
			<mod>
				<mod_date>2002/09/18</mod_date>
			</mod>
			<note>의성, 중첩</note>
			<see></see>
		</mnt_grp>
		<morph_grp>
			<var type="xs"></var>
			<var type="xd"></var>
			<var type="xx"></var>
			<str>구시렁+구시렁</str>
			<org lg="temp"></org>
			<hom exist="temp"></hom>
			<comp pos="v">~하다</comp>
			<img type="xc">고시랑고시랑</img>
		</morph_grp>
		<idm_grp>
		</idm_grp>
		<sense n="1">
			<sem_grp>
				<eg>그는 불만에 찬 표정으로 ~ 중얼대고 있었다</eg>
				<trans>grumbling</trans>
				<domain></domain>
				<reg></reg>
				<con></con>
				
				<sem_rep>성분부사/양태부사/상징</sem_rep>
				<lr>
					<syn></syn>
					<ant></ant>
					<hyper></hyper>
					<cohyp></cohyp>
					<holo></holo>
					<mero></mero>
					<rel>구시렁거리다</rel>
				</lr>
			</sem_grp>
			<syn_grp>
				<comb pos="v" exist="yes">~중얼거리다</comb>
				<comb pos="adj" exist="no"/>
				<comb pos="det" exist="temp"></comb>
				<comb pos="av" exist="temp"></comb>
				<comb pos="n" exist="temp"></comb>
				<prt></prt>
				<argdist type="np"></argdist>
				<argdist type="vp"></argdist>
				<argdist type="ap"></argdist>
				<col></col>
			
			
				<conc type="conj"></conc>
				<conc type="mood"></conc>
				<conc type="mod"></conc>
				<conc type="ta"></conc>
				<conc type="neg"></conc>
				<conc type="agr"></conc>
				<distr>SO~V</distr>
			</syn_grp>
		</sense>
	</entry>
	<entry n="2" pos="av">
		
		<mnt_grp>
			<cre>
				<cre_writer>김태경</cre_writer>
				<cre_date>2002/05/23</cre_date>
				<cre_note></cre_note>
			</cre>
			<note>의태, 중 첩</note>
			<see></see>
		</mnt_grp>
		<morph_grp>
			<var type="xs"></var>
			<var type="xd"></var>
			<var type="xx"></var>
			<str>구시렁+구시렁</str>
			<org lg="temp"></org>
			<hom exist="temp"></hom>
			<comp pos="v">~하다</comp>
		</morph_grp>
		<idm_grp>
		</idm_grp>
		<sense n="1">
			<sem_grp>
				<eg>잠을 못 이루고 밤새 ~ 몸을 뒤척이고 있다</eg>
				<trans>tossing and turning</trans>
				<domain></domain>
				<reg></reg>
				<con></con>
				
				<sem_rep>성분부사/양태부사/상징</sem_rep>
				<lr>
					<syn>뒤척뒤척</syn>
					<ant></ant>
					<hyper></hyper>
					<cohyp></cohyp>
					<holo></holo>
					<mero></mero>
					<rel>구시렁거리다</rel>
				</lr>
			</sem_grp>
			<syn_grp>
				<comb pos="v" exist="yes">~뒤척이다</comb>
				<comb pos="adj" exist="no"/>
				<comb pos="det" exist="temp"></comb>
				<comb pos="av" exist="temp"></comb>
				<comb pos="n" exist="temp"></comb>
				<prt></prt>
				<argdist type="np"></argdist>
				<argdist type="vp"></argdist>
				<argdist type="ap"></argdist>
				<col></col>
			
			
				<conc type="conj"></conc>
				<conc type="mood"></conc>
				<conc type="mod"></conc>
				<conc type="ta"></conc>
				<conc type="neg"></conc>
				<conc type="agr"></conc>
				<distr>SO~V</distr>
			</syn_grp>
		</sense>
	</entry>
</superEntry>
