<?xml version="1.0" encoding="euc-kr" standalone="no"?>
<!DOCTYPE superEntry SYSTEM "dic_adverb.dtd">
<superEntry>
	<orth>가뜩</orth>
	<entry n="1" pos="av">
		
		<mnt_grp>
			<cre>
				<cre_writer>김태경; 남승호</cre_writer>
				<cre_date>2002/04/07</cre_date>
				<cre_note></cre_note>
			</cre>
			<mod>
				<mod_date>2002/07/20</mod_date>
			</mod>
			<note></note>
			<see></see>
		</mnt_grp>
		<morph_grp>
			<var type="xs"></var>
			<var type="xd"></var>
			<var type="xx"></var>
			<org lg="temp"></org>
			<hom exist="temp"></hom>
			<img type="xl">가득</img>
			<img type="xg">그뜩</img>
		</morph_grp>
		<idm_grp>
		</idm_grp>
		<sense n="1">
			<sem_grp>
				<eg>컵에 물을 ~ 담아라</eg>
				<trans>fully</trans>
				<domain></domain>
				<reg></reg>
				<con></con>
				
				<sem_rep>성분부사/양태부사/방식</sem_rep>
				<lr>
					<syn></syn>
					<ant></ant>
					<hyper></hyper>
					<cohyp></cohyp>
					<holo></holo>
					<mero></mero>
					<rel>가뜩하다</rel>
				</lr>
			</sem_grp>
			<syn_grp>
				<comb pos="v" exist="yes">~담다</comb>
				<comb pos="adj" exist="no"/>
				<comb pos="det" exist="temp"></comb>
				<comb pos="av" exist="temp"></comb>
				<comb pos="n" exist="temp"></comb>
				<prt></prt>
				<argdist type="np"></argdist>
				<argdist type="vp"></argdist>
				<argdist type="ap"></argdist>
				<col></col>
			
			
				<conc type="conj"></conc>
				<conc type="mood"></conc>
				<conc type="mod"></conc>
				<conc type="ta"></conc>
				<conc type="neg"></conc>
				<conc type="agr"></conc>
				<distr>SO~V</distr>
			</syn_grp>
		</sense>
	</entry>
	<entry n="2" pos="av">
		
		<mnt_grp>
			<cre>
				<cre_writer>김태경; 남승호</cre_writer>
				<cre_date>2002/04/07</cre_date>
				<cre_note></cre_note>
			</cre>
			<mod>
				<mod_date>2002/07/26</mod_date>
			</mod>
			<note></note>
			<see></see>
		</mnt_grp>
		<morph_grp>
			<var type="xs"></var>
			<var type="xd"></var>
			<var type="xx"></var>
			<org lg="temp"></org>
			<hom exist="temp"></hom>
			<comp pos="av">~이나</comp>
		</morph_grp>
		<idm_grp>
		</idm_grp>
		<sense n="1">
			<sem_grp>
				<eg>~ 장사가 안되는데, 너까지 그만두면 어떻게 하니?</eg>
				<trans>on top of that</trans>
				<domain></domain>
				<reg></reg>
				<con></con>
				
				<sem_rep>문장부사/양상부사/강조</sem_rep>
				<lr>
					<syn>가뜩이나</syn>
					<ant></ant>
					<hyper></hyper>
					<cohyp></cohyp>
					<holo></holo>
					<mero></mero>
					<rel></rel>
				</lr>
			</sem_grp>
			<syn_grp>
				<comb pos="v" exist="temp"></comb>
				<comb pos="adj" exist="temp"></comb>
				<comb pos="det" exist="temp"></comb>
				<comb pos="av" exist="temp"></comb>
				<comb pos="n" exist="temp"></comb>
				<prt></prt>
				<argdist type="np"></argdist>
				<argdist type="vp"></argdist>
				<argdist type="ap"></argdist>
				<col></col>
			
			
				<conc type="conj">~-는데</conc>
				<conc type="mood"></conc>
				<conc type="mod"></conc>
				<conc type="ta"></conc>
				<conc type="neg"></conc>
				<conc type="agr"></conc>
				<distr>SO~V</distr>
			</syn_grp>
		</sense>
	</entry>
</superEntry>
