<?xml version="1.0" encoding="euc-kr" standalone="no"?>
<!DOCTYPE superEntry SYSTEM "dic_adverb.dtd">
<superEntry>
	<orth>협조없이</orth>
	<entry n="1" pos="av">
		
		<mnt_grp>
			<cre>
				<cre_writer>류병률; 남승호</cre_writer>
				<cre_date>2001/07/01</cre_date>
				<cre_note></cre_note>
			</cre>
			<mod>
				<mod_date>2001/09/08</mod_date>
			</mod>
			<note></note>
			<see></see>
		</mnt_grp>
		<morph_grp>
			<var type="xs"></var>
			<var type="xd"></var>
			<var type="xx"></var>
			<str>협조+없.이</str>
			<org lg="si">協助__</org>
			<hom exist="temp"></hom>
		</morph_grp>
		<idm_grp>
		</idm_grp>
		<sense n="1">
			<sem_grp>
				<eg>안기부의 직간접적인 지시나 통제 혹은~ 군이 독자적으로 정치공작을 저지른다</eg>
				<trans>without cooperation</trans>
				<domain></domain>
				<reg></reg>
				<con></con>
				
				<sem_rep>성분부사/양태부사/방식</sem_rep>
				<lr>
					<syn>협력없이</syn>
					<syn>독자적으로</syn>
					<ant>협력하여</ant>
					<hyper></hyper>
					<cohyp></cohyp>
					<hypo></hypo>
					<holo></holo>
					<mero></mero>
					<rel></rel>
				</lr>
			</sem_grp>
			<syn_grp>
				<comb pos="v" exist="yes">~진행하다</comb>
				<comb pos="adj" exist="no"/>
				<comb pos="det" exist="temp"></comb>
				<comb pos="av" exist="temp"></comb>
				<comb pos="n" exist="temp"></comb>
				<prt></prt>
				<argdist type="np"></argdist>
				<argdist type="vp"></argdist>
				<argdist type="ap"></argdist>
				<col></col>
			
			
				<conc type="conj"></conc>
				<conc type="mood"></conc>
				<conc type="mod"></conc>
				<conc type="ta"></conc>
				<conc type="neg"></conc>
				<conc type="agr"></conc>
				<distr>S~O~V</distr>
			</syn_grp>
		</sense>
	</entry>
</superEntry>
