<?xml version="1.0" encoding="euc-kr" standalone="no"?>
<!DOCTYPE superEntry SYSTEM "dic_adverb.dtd">
<superEntry>
	<orth>홀라당</orth>
	<entry n="1" pos="av">
		
		<mnt_grp>
			<cre>
				<cre_writer>김태경; 남승호</cre_writer>
				<cre_date>2002/05/17</cre_date>
				<cre_note></cre_note>
			</cre>
			<mod>
				<mod_date>2002/07/26</mod_date>
			</mod>
			<note>의태, 부분중첩</note>
			<see></see>
		</mnt_grp>
		<morph_grp>
			<var type="xs"></var>
			<var type="xd"></var>
			<var type="xx"></var>
			<var type="abb">홀랑</var>
			<org lg="temp"></org>
			<hom exist="temp"></hom>
			<comp pos="n">~알몸</comp>
			<comp pos="n">~대머리</comp>
			<comp pos="n">~속임수</comp>
			<img type="xg">훌러덩</img>
		</morph_grp>
		<idm_grp>
		</idm_grp>
		<sense n="1">
			<sem_grp>
				<eg>바람에 가발이 ~ 벗겨졌다</eg>
				<trans>removing completely</trans>
				<domain></domain>
				<reg></reg>
				<con></con>
				
				<sem_rep>성분부사/양태부사/상징</sem_rep>
				<lr>
					<syn>홀딱</syn>
					<syn>홀랑</syn>
					<ant></ant>
					<hyper></hyper>
					<cohyp></cohyp>
					<holo></holo>
					<mero></mero>
					<rel></rel>
				</lr>
			</sem_grp>
			<syn_grp>
				<comb pos="v" exist="yes">~벗다</comb>
				<comb pos="v" exist="yes">~뒤집다</comb>
				<comb pos="adj" exist="no"/>
				<comb pos="det" exist="temp"></comb>
				<comb pos="av" exist="temp"></comb>
				<comb pos="n" exist="temp"></comb>
				<prt></prt>
				<argdist type="np"></argdist>
				<argdist type="vp"></argdist>
				<argdist type="ap"></argdist>
				<col></col>
			
			
				<conc type="conj"></conc>
				<conc type="mood"></conc>
				<conc type="mod"></conc>
				<conc type="ta"></conc>
				<conc type="neg"></conc>
				<conc type="agr"></conc>
				<distr>SO~V</distr>
			</syn_grp>
		</sense>
		<sense n="2">
			<sem_grp>
				<eg>그는 내 감언이설에 ~ 넘어왔다</eg>
				<trans>deeply</trans>
				<trans>madly</trans>
				<domain></domain>
				<reg></reg>
				<con></con>
				
				<sem_rep>성분부사/양태부사/상징</sem_rep>
				<lr>
					<syn>홀랑</syn>
					<syn>홀딱</syn>
					<ant></ant>
					<hyper></hyper>
					<cohyp></cohyp>
					<holo></holo>
					<mero></mero>
					<rel></rel>
				</lr>
			</sem_grp>
			<syn_grp>
				<comb pos="v" exist="yes">~넘어가다</comb>
				<comb pos="v" exist="yes">~반하다</comb>
				<comb pos="adj" exist="no"/>
				<comb pos="det" exist="temp"></comb>
				<comb pos="av" exist="temp"></comb>
				<comb pos="n" exist="temp"></comb>
				<prt></prt>
				<argdist type="np"></argdist>
				<argdist type="vp"></argdist>
				<argdist type="ap"></argdist>
				<col></col>
			
			
				<conc type="conj"></conc>
				<conc type="mood"></conc>
				<conc type="mod"></conc>
				<conc type="ta"></conc>
				<conc type="neg"></conc>
				<conc type="agr"></conc>
				<distr>SO~V</distr>
			</syn_grp>
		</sense>
	</entry>
</superEntry>
